<?xml version="1.0" encoding="UTF-8"?>
<livre xmlns:xsi="http://www.w3.org/2001/XMLSchema-instance" xsi:noNamespaceSchemaLocation="test.xsd">

  <secuencias>
    <impair>qwe</impair>
    <pair>qwe</pair>
    <impair>qwe</impair>
    <pair>qwe</pair>
    <impair>qwe</impair>
    <pair>qwe</pair>
    <impair>qwe</impair>
    <pair>qwe</pair>
    <impair>qwe</impair>
    <pair>qwe</pair>
    <impair>qwe</impair>
    <pair>qwe</pair>
  </secuencias>

  <impair>qwe</impair>

</livre>